{"carrier_kind":"dependency_classification","derived_data":{"blocking_dependencies":[],"classifications":[{"architect_node_ref":"node-root","classification":"not_applicable","dependency_id":"node-root:R16_ACCESSIBILITY_CLAIM_REQUIRES_EVIDENCE:accessibility","dependency_kind":"accessibility","downstream_owner":"ce","evidence_refs":[],"reason":"No accessibility claim is made.","review_unit_id":"node-root","rule_id":"R16_ACCESSIBILITY_CLAIM_REQUIRES_EVIDENCE"},{"architect_node_ref":"node-root","classification":"not_applicable","dependency_id":"node-root:R04_ASSET_SOURCE_OR_PLACEHOLDER:asset","dependency_kind":"asset","downstream_owner":"ce","evidence_refs":[],"reason":"Asset evidence is not required.","review_unit_id":"node-root","rule_id":"R04_ASSET_SOURCE_OR_PLACEHOLDER"},{"architect_node_ref":"node-root","classification":"not_applicable","dependency_id":"node-root:R09_STRUCTURE_OR_CLASS_CHANGE_REQUIRES_PERMISSION:class_change","dependency_kind":"class_change","downstream_owner":"ce","evidence_refs":[],"reason":"class_change is not required.","review_unit_id":"node-root","rule_id":"R09_STRUCTURE_OR_CLASS_CHANGE_REQUIRES_PERMISSION"},{"architect_node_ref":"node-root","classification":"not_applicable","dependency_id":"node-root:R08_DYNAMIC_LOOP_REQUIRES_APPROVAL:dynamic_loop","dependency_kind":"dynamic_loop","downstream_owner":"ce","evidence_refs":[],"reason":"No Dynamic Loop is implied.","review_unit_id":"node-root","rule_id":"R08_DYNAMIC_LOOP_REQUIRES_APPROVAL"},{"architect_node_ref":"node-root","classification":"not_applicable","dependency_id":"node-root:R10_UI_CONTROL_PATH_REQUIRES_EVIDENCE:exact_ui_control_path","dependency_kind":"exact_ui_control_path","downstream_owner":"ce","evidence_refs":[],"reason":"No exact UI path is asserted.","review_unit_id":"node-root","rule_id":"R10_UI_CONTROL_PATH_REQUIRES_EVIDENCE"},{"architect_node_ref":"node-root","classification":"not_applicable","dependency_id":"node-root:R03_GEOMETRY_MUST_BE_PROVEN:geometry","dependency_kind":"geometry","downstream_owner":"ce","evidence_refs":[],"reason":"Geometry is not required.","review_unit_id":"node-root","rule_id":"R03_GEOMETRY_MUST_BE_PROVEN"},{"architect_node_ref":"node-root","classification":"not_applicable","dependency_id":"node-root:R07_INTERACTION_REQUIRES_APPROVAL:interaction","dependency_kind":"interaction","downstream_owner":"ce","evidence_refs":[],"reason":"No interaction is implied.","review_unit_id":"node-root","rule_id":"R07_INTERACTION_REQUIRES_APPROVAL"},{"architect_node_ref":"node-root","classification":"not_applicable","dependency_id":"node-root:R05_OVERLAY_STRATEGY_MUST_BE_PROVEN:overlay","dependency_kind":"overlay","downstream_owner":"ce","evidence_refs":[],"reason":"Overlay strategy is not required.","review_unit_id":"node-root","rule_id":"R05_OVERLAY_STRATEGY_MUST_BE_PROVEN"},{"architect_node_ref":"node-root","classification":"not_applicable","dependency_id":"node-root:R06_RESPONSIVE_ACTION_REQUIRES_STRATEGY_OR_BLOCK:responsive","dependency_kind":"responsive","downstream_owner":"ce","evidence_refs":[],"reason":"Action does not target responsive behavior.","review_unit_id":"node-root","rule_id":"R06_RESPONSIVE_ACTION_REQUIRES_STRATEGY_OR_BLOCK"},{"architect_node_ref":"node-root","classification":"not_applicable","dependency_id":"node-root:R09_STRUCTURE_OR_CLASS_CHANGE_REQUIRES_PERMISSION:structure_change","dependency_kind":"structure_change","downstream_owner":"ce","evidence_refs":[],"reason":"structure_change is not required.","review_unit_id":"node-root","rule_id":"R09_STRUCTURE_OR_CLASS_CHANGE_REQUIRES_PERMISSION"},{"architect_node_ref":"node-wrapper","classification":"not_applicable","dependency_id":"node-wrapper:R16_ACCESSIBILITY_CLAIM_REQUIRES_EVIDENCE:accessibility","dependency_kind":"accessibility","downstream_owner":"ce","evidence_refs":[],"reason":"No accessibility claim is made.","review_unit_id":"node-wrapper","rule_id":"R16_ACCESSIBILITY_CLAIM_REQUIRES_EVIDENCE"},{"architect_node_ref":"node-wrapper","classification":"not_applicable","dependency_id":"node-wrapper:R04_ASSET_SOURCE_OR_PLACEHOLDER:asset","dependency_kind":"asset","downstream_owner":"ce","evidence_refs":[],"reason":"Asset evidence is not required.","review_unit_id":"node-wrapper","rule_id":"R04_ASSET_SOURCE_OR_PLACEHOLDER"},{"architect_node_ref":"node-wrapper","classification":"not_applicable","dependency_id":"node-wrapper:R09_STRUCTURE_OR_CLASS_CHANGE_REQUIRES_PERMISSION:class_change","dependency_kind":"class_change","downstream_owner":"ce","evidence_refs":[],"reason":"class_change is not required.","review_unit_id":"node-wrapper","rule_id":"R09_STRUCTURE_OR_CLASS_CHANGE_REQUIRES_PERMISSION"},{"architect_node_ref":"node-wrapper","classification":"not_applicable","dependency_id":"node-wrapper:R08_DYNAMIC_LOOP_REQUIRES_APPROVAL:dynamic_loop","dependency_kind":"dynamic_loop","downstream_owner":"ce","evidence_refs":[],"reason":"No Dynamic Loop is implied.","review_unit_id":"node-wrapper","rule_id":"R08_DYNAMIC_LOOP_REQUIRES_APPROVAL"},{"architect_node_ref":"node-wrapper","classification":"not_applicable","dependency_id":"node-wrapper:R10_UI_CONTROL_PATH_REQUIRES_EVIDENCE:exact_ui_control_path","dependency_kind":"exact_ui_control_path","downstream_owner":"ce","evidence_refs":[],"reason":"No exact UI path is asserted.","review_unit_id":"node-wrapper","rule_id":"R10_UI_CONTROL_PATH_REQUIRES_EVIDENCE"},{"architect_node_ref":"node-wrapper","classification":"not_applicable","dependency_id":"node-wrapper:R03_GEOMETRY_MUST_BE_PROVEN:geometry","dependency_kind":"geometry","downstream_owner":"ce","evidence_refs":[],"reason":"Geometry is not required.","review_unit_id":"node-wrapper","rule_id":"R03_GEOMETRY_MUST_BE_PROVEN"},{"architect_node_ref":"node-wrapper","classification":"not_applicable","dependency_id":"node-wrapper:R07_INTERACTION_REQUIRES_APPROVAL:interaction","dependency_kind":"interaction","downstream_owner":"ce","evidence_refs":[],"reason":"No interaction is implied.","review_unit_id":"node-wrapper","rule_id":"R07_INTERACTION_REQUIRES_APPROVAL"},{"architect_node_ref":"node-wrapper","classification":"not_applicable","dependency_id":"node-wrapper:R05_OVERLAY_STRATEGY_MUST_BE_PROVEN:overlay","dependency_kind":"overlay","downstream_owner":"ce","evidence_refs":[],"reason":"Overlay strategy is not required.","review_unit_id":"node-wrapper","rule_id":"R05_OVERLAY_STRATEGY_MUST_BE_PROVEN"},{"architect_node_ref":"node-wrapper","classification":"not_applicable","dependency_id":"node-wrapper:R06_RESPONSIVE_ACTION_REQUIRES_STRATEGY_OR_BLOCK:responsive","dependency_kind":"responsive","downstream_owner":"ce","evidence_refs":[],"reason":"Action does not target responsive behavior.","review_unit_id":"node-wrapper","rule_id":"R06_RESPONSIVE_ACTION_REQUIRES_STRATEGY_OR_BLOCK"},{"architect_node_ref":"node-wrapper","classification":"not_applicable","dependency_id":"node-wrapper:R09_STRUCTURE_OR_CLASS_CHANGE_REQUIRES_PERMISSION:structure_change","dependency_kind":"structure_change","downstream_owner":"ce","evidence_refs":[],"reason":"structure_change is not required.","review_unit_id":"node-wrapper","rule_id":"R09_STRUCTURE_OR_CLASS_CHANGE_REQUIRES_PERMISSION"}],"coverage":{"actual_classification_count":20,"classification_traceability_complete":true,"every_review_unit_classified":true,"expected_classification_count":20,"review_unit_count":2},"dependency_dimensions":["accessibility","asset","class_change","dynamic_loop","exact_ui_control_path","geometry","interaction","overlay","responsive","structure_change"],"non_blocking_obligations":[],"payload_projection":{"blocking_dependencies":[],"required_evidence_refs":[],"required_unresolved_ids":[]},"review_unit_ids":["node-root","node-wrapper"],"unresolved_dependencies":[]},"diagnostics":[],"owner_repository":"rezahh107/EV4-Constructability-Engineer-Repo","run_id":"ce-intermediate-fixture-001","schema_id":"ev4-ce-intermediate-validation-carrier@1.0.0","schema_version":"1.0.0","source_identities":[{"identity":"CRR-INTERMEDIATE-001","sha256":"4f2d7386830a1b7f16212780b632963d55efba5da4dd984a436dc1cda537c74d","source_kind":"constructability_review"},{"identity":"ce_review_units_and_interrogation_results","sha256":"7739f26787a6e2041c544367c46424f928b9bf3c004b3a453589cf6eb2acdd40","source_kind":"review_carrier"}],"status":"complete"}
