{"carrier_kind":"implementation_strategy_coverage_result","derived_data":{"absence_reason":null,"builder_decisions_remaining":0,"coverage_by_dependency":[{"classification":"not_applicable","covered":true,"dependency_id":"node-root:R03_GEOMETRY_MUST_BE_PROVEN:geometry","review_unit_id":"node-root","strategy_ids":["STR-NODE-ROOT"]},{"classification":"not_applicable","covered":true,"dependency_id":"node-root:R04_ASSET_SOURCE_OR_PLACEHOLDER:asset","review_unit_id":"node-root","strategy_ids":["STR-NODE-ROOT"]},{"classification":"not_applicable","covered":true,"dependency_id":"node-root:R05_OVERLAY_STRATEGY_MUST_BE_PROVEN:overlay","review_unit_id":"node-root","strategy_ids":["STR-NODE-ROOT"]},{"classification":"not_applicable","covered":true,"dependency_id":"node-root:R06_RESPONSIVE_ACTION_REQUIRES_STRATEGY_OR_BLOCK:responsive","review_unit_id":"node-root","strategy_ids":["STR-NODE-ROOT"]},{"classification":"not_applicable","covered":true,"dependency_id":"node-root:R07_INTERACTION_REQUIRES_APPROVAL:interaction","review_unit_id":"node-root","strategy_ids":["STR-NODE-ROOT"]},{"classification":"not_applicable","covered":true,"dependency_id":"node-root:R08_DYNAMIC_LOOP_REQUIRES_APPROVAL:dynamic_loop","review_unit_id":"node-root","strategy_ids":["STR-NODE-ROOT"]},{"classification":"not_applicable","covered":true,"dependency_id":"node-root:R09_STRUCTURE_OR_CLASS_CHANGE_REQUIRES_PERMISSION:class_change","review_unit_id":"node-root","strategy_ids":["STR-NODE-ROOT"]},{"classification":"not_applicable","covered":true,"dependency_id":"node-root:R09_STRUCTURE_OR_CLASS_CHANGE_REQUIRES_PERMISSION:structure_change","review_unit_id":"node-root","strategy_ids":["STR-NODE-ROOT"]},{"classification":"not_applicable","covered":true,"dependency_id":"node-root:R10_UI_CONTROL_PATH_REQUIRES_EVIDENCE:exact_ui_control_path","review_unit_id":"node-root","strategy_ids":["STR-NODE-ROOT"]},{"classification":"not_applicable","covered":true,"dependency_id":"node-root:R16_ACCESSIBILITY_CLAIM_REQUIRES_EVIDENCE:accessibility","review_unit_id":"node-root","strategy_ids":["STR-NODE-ROOT"]},{"classification":"not_applicable","covered":true,"dependency_id":"node-wrapper:R03_GEOMETRY_MUST_BE_PROVEN:geometry","review_unit_id":"node-wrapper","strategy_ids":["STR-NODE-WRAPPER"]},{"classification":"not_applicable","covered":true,"dependency_id":"node-wrapper:R04_ASSET_SOURCE_OR_PLACEHOLDER:asset","review_unit_id":"node-wrapper","strategy_ids":["STR-NODE-WRAPPER"]},{"classification":"not_applicable","covered":true,"dependency_id":"node-wrapper:R05_OVERLAY_STRATEGY_MUST_BE_PROVEN:overlay","review_unit_id":"node-wrapper","strategy_ids":["STR-NODE-WRAPPER"]},{"classification":"not_applicable","covered":true,"dependency_id":"node-wrapper:R06_RESPONSIVE_ACTION_REQUIRES_STRATEGY_OR_BLOCK:responsive","review_unit_id":"node-wrapper","strategy_ids":["STR-NODE-WRAPPER"]},{"classification":"not_applicable","covered":true,"dependency_id":"node-wrapper:R07_INTERACTION_REQUIRES_APPROVAL:interaction","review_unit_id":"node-wrapper","strategy_ids":["STR-NODE-WRAPPER"]},{"classification":"not_applicable","covered":true,"dependency_id":"node-wrapper:R08_DYNAMIC_LOOP_REQUIRES_APPROVAL:dynamic_loop","review_unit_id":"node-wrapper","strategy_ids":["STR-NODE-WRAPPER"]},{"classification":"not_applicable","covered":true,"dependency_id":"node-wrapper:R09_STRUCTURE_OR_CLASS_CHANGE_REQUIRES_PERMISSION:class_change","review_unit_id":"node-wrapper","strategy_ids":["STR-NODE-WRAPPER"]},{"classification":"not_applicable","covered":true,"dependency_id":"node-wrapper:R09_STRUCTURE_OR_CLASS_CHANGE_REQUIRES_PERMISSION:structure_change","review_unit_id":"node-wrapper","strategy_ids":["STR-NODE-WRAPPER"]},{"classification":"not_applicable","covered":true,"dependency_id":"node-wrapper:R10_UI_CONTROL_PATH_REQUIRES_EVIDENCE:exact_ui_control_path","review_unit_id":"node-wrapper","strategy_ids":["STR-NODE-WRAPPER"]},{"classification":"not_applicable","covered":true,"dependency_id":"node-wrapper:R16_ACCESSIBILITY_CLAIM_REQUIRES_EVIDENCE:accessibility","review_unit_id":"node-wrapper","strategy_ids":["STR-NODE-WRAPPER"]}],"coverage_by_review_unit":[{"covered":true,"review_unit_id":"node-root","strategy_ids":["STR-NODE-ROOT"]},{"covered":true,"review_unit_id":"node-wrapper","strategy_ids":["STR-NODE-WRAPPER"]}],"first_safe_batch_status":"complete","payload_projection":{"builder_package_not_emitted_reason":null,"implementation_strategy_map":{"review_ref":"CRR-INTERMEDIATE-001","selected_candidate_id":"ARCH-FAM-C","strategies":[{"alternatives_considered":[],"architect_amendment_required":false,"builder_decisions_required":0,"class_names_affected":["smart-home__section"],"evidence_source":"architect_package","node_id":"node-root","rationale":"Approved structure is directly implementable.","strategy_id":"STR-NODE-ROOT","strategy_selected":"preserve_section_root","structure_change_required":false},{"alternatives_considered":[],"architect_amendment_required":false,"builder_decisions_required":0,"class_names_affected":["smart-home__stage--relative"],"evidence_source":"architect_package","node_id":"node-wrapper","rationale":"Approved wrapper is directly implementable.","strategy_id":"STR-NODE-WRAPPER","strategy_selected":"preserve_grouping_wrapper","structure_change_required":false}],"strategy_map_id":"ISM-INTERMEDIATE-001"},"required_unresolved_ids":[]},"strategy_identity":"ISM-INTERMEDIATE-001","strategy_map":{"review_ref":"CRR-INTERMEDIATE-001","selected_candidate_id":"ARCH-FAM-C","strategies":[{"alternatives_considered":[],"architect_amendment_required":false,"builder_decisions_required":0,"class_names_affected":["smart-home__section"],"evidence_source":"architect_package","node_id":"node-root","rationale":"Approved structure is directly implementable.","strategy_id":"STR-NODE-ROOT","strategy_selected":"preserve_section_root","structure_change_required":false},{"alternatives_considered":[],"architect_amendment_required":false,"builder_decisions_required":0,"class_names_affected":["smart-home__stage--relative"],"evidence_source":"architect_package","node_id":"node-wrapper","rationale":"Approved wrapper is directly implementable.","strategy_id":"STR-NODE-WRAPPER","strategy_selected":"preserve_grouping_wrapper","structure_change_required":false}],"strategy_map_id":"ISM-INTERMEDIATE-001"},"strategy_present":true,"uncovered_dependencies":[],"uncovered_review_units":[]},"diagnostics":[],"owner_repository":"rezahh107/EV4-Constructability-Engineer-Repo","run_id":"ce-intermediate-fixture-001","schema_id":"ev4-ce-intermediate-validation-carrier@1.0.0","schema_version":"1.0.0","source_identities":[{"identity":"BEP-INTERMEDIATE-001","sha256":"f1f209f7949f9aec2099148dd699145d4ce6fe8014c7638c32c06cb3bca638c7","source_kind":"builder_executable_package"},{"identity":"dependency_classification","sha256":"ccd863615904383e59f69fbc0bc6ba7df826f71f024a4972bcd7690c5fcd9745","source_kind":"dependency_carrier"},{"identity":"architecture_identity_preservation_result","sha256":"f7d55c30eebdfdfd70e01f4bfb0c2bdddf015ac3a490ee286a8547e6b276b455","source_kind":"identity_carrier"},{"identity":"ISM-INTERMEDIATE-001","sha256":"b903d6a59a84a3adc2eeffbee5595adb4c0737b1eb812f18639ae0a2ce3e5019","source_kind":"implementation_strategy_map"},{"identity":"ce_review_units_and_interrogation_results","sha256":"7739f26787a6e2041c544367c46424f928b9bf3c004b3a453589cf6eb2acdd40","source_kind":"review_carrier"}],"status":"complete"}
