{"carrier_kind":"ce_review_units_and_interrogation_results","derived_data":{"coverage":{"duplicate_review_unit_ids":[],"duplicate_source_mappings":[],"missing_source_nodes":[],"orphan_review_units":[],"required_count":2,"reviewed_count":2,"traceability_complete":true},"payload_projection":{"review_unit_traces":[{"architect_evidence_refs":["ev-tree"],"architect_node_ref":"node-root","ce_review_unit_id":"node-root","identity_unchanged":true},{"architect_evidence_refs":["ev-tree"],"architect_node_ref":"node-wrapper","ce_review_unit_id":"node-wrapper","identity_unchanged":true}],"reviewed_nodes":[{"action_proposed":"preserve approved section root","architect_evidence_refs":["ev-tree"],"architect_node_ref":"node-root","blocking_reason":null,"interrogation_result":{"accessibility_claimed":false,"accessibility_evidenced":null,"action_targets_responsive":false,"architect_decomposition_permission":false,"asset_required":false,"asset_source_present":null,"dynamic_loop_approved":null,"dynamic_loop_implied":false,"exact_ui_control_path_used":false,"geometry_proven":null,"geometry_required":false,"interaction_approved":null,"interaction_implied":false,"overlay_strategy_proven":null,"overlay_strategy_required":false,"placeholder_policy_present":null,"requires_class_change":false,"requires_structure_change":false,"responsive_behavior":"not_applicable","reversible_if_wrong":true,"ui_control_evidence_present":null},"node_id":"node-root","node_status":"executable_ready","node_type":"section_root","review_unit_id":"node-root"},{"action_proposed":"preserve approved grouping wrapper","architect_evidence_refs":["ev-tree"],"architect_node_ref":"node-wrapper","blocking_reason":null,"interrogation_result":{"accessibility_claimed":false,"accessibility_evidenced":null,"action_targets_responsive":false,"architect_decomposition_permission":false,"asset_required":false,"asset_source_present":null,"dynamic_loop_approved":null,"dynamic_loop_implied":false,"exact_ui_control_path_used":false,"geometry_proven":null,"geometry_required":false,"interaction_approved":null,"interaction_implied":false,"overlay_strategy_proven":null,"overlay_strategy_required":false,"placeholder_policy_present":null,"requires_class_change":false,"requires_structure_change":false,"responsive_behavior":"not_applicable","reversible_if_wrong":true,"ui_control_evidence_present":null},"node_id":"node-wrapper","node_status":"executable_ready","node_type":"wrapper","review_unit_id":"node-wrapper"}]},"required_source_nodes":["node-root","node-wrapper"],"review_unit_traces":[{"architect_evidence_refs":["ev-tree"],"architect_node_ref":"node-root","ce_review_unit_id":"node-root","identity_unchanged":true},{"architect_evidence_refs":["ev-tree"],"architect_node_ref":"node-wrapper","ce_review_unit_id":"node-wrapper","identity_unchanged":true}],"review_units":[{"action_proposed":"preserve approved section root","architect_evidence_refs":["ev-tree"],"architect_node_ref":"node-root","blocking_reason":null,"interrogation_result":{"accessibility_claimed":false,"accessibility_evidenced":null,"action_targets_responsive":false,"architect_decomposition_permission":false,"asset_required":false,"asset_source_present":null,"dynamic_loop_approved":null,"dynamic_loop_implied":false,"exact_ui_control_path_used":false,"geometry_proven":null,"geometry_required":false,"interaction_approved":null,"interaction_implied":false,"overlay_strategy_proven":null,"overlay_strategy_required":false,"placeholder_policy_present":null,"requires_class_change":false,"requires_structure_change":false,"responsive_behavior":"not_applicable","reversible_if_wrong":true,"ui_control_evidence_present":null},"node_id":"node-root","node_status":"executable_ready","node_type":"section_root","review_unit_id":"node-root"},{"action_proposed":"preserve approved grouping wrapper","architect_evidence_refs":["ev-tree"],"architect_node_ref":"node-wrapper","blocking_reason":null,"interrogation_result":{"accessibility_claimed":false,"accessibility_evidenced":null,"action_targets_responsive":false,"architect_decomposition_permission":false,"asset_required":false,"asset_source_present":null,"dynamic_loop_approved":null,"dynamic_loop_implied":false,"exact_ui_control_path_used":false,"geometry_proven":null,"geometry_required":false,"interaction_approved":null,"interaction_implied":false,"overlay_strategy_proven":null,"overlay_strategy_required":false,"placeholder_policy_present":null,"requires_class_change":false,"requires_structure_change":false,"responsive_behavior":"not_applicable","reversible_if_wrong":true,"ui_control_evidence_present":null},"node_id":"node-wrapper","node_status":"executable_ready","node_type":"wrapper","review_unit_id":"node-wrapper"}]},"diagnostics":[],"owner_repository":"rezahh107/EV4-Constructability-Engineer-Repo","run_id":"ce-intermediate-fixture-001","schema_id":"ev4-ce-intermediate-validation-carrier@1.0.0","schema_version":"1.0.0","source_identities":[{"identity":"ev4-ce-architect-stage-intake@1.1.0","sha256":"f8cede7b74b6d14b33004c26ed4eae267c1167cdc490d2ec960ed5b3e15a994b","source_kind":"architect_intake"},{"identity":"CRR-INTERMEDIATE-001","sha256":"4f2d7386830a1b7f16212780b632963d55efba5da4dd984a436dc1cda537c74d","source_kind":"constructability_review"}],"status":"complete"}
