{"carrier_kind":"architecture_identity_preservation_result","derived_data":{"approved_class_names":{"expected":["smart-home__section","smart-home__stage--relative"],"matches":true,"observed":["smart-home__section","smart-home__stage--relative"],"trusted_source":["smart-home__section","smart-home__stage--relative"]},"architect_unknowns":{"expected_ids":[],"extra_ids":[],"missing_ids":[],"observed_ids":[]},"architecture_redesign_absent":true,"build_tree_identity":{"expected_node_ids":["node-root","node-wrapper"],"matches_or_insufficient":true,"observed_node_ids":["node-root","node-wrapper"],"trusted_source_node_ids":["node-root","node-wrapper"]},"forbidden_work":{"expected_ids":["no_claim_builder_ready","no_invent_assets","no_invent_breakpoints","no_invent_geometry"],"missing_ids":[],"observed_ids":["no_claim_builder_ready","no_invent_assets","no_invent_breakpoints","no_invent_geometry"]},"payload_projection":{"approved_class_names":["smart-home__section","smart-home__stage--relative"],"approved_class_names_unchanged":true,"architect_forbidden_work_weakened":false,"architect_unknowns_preserved":true,"build_tree_identity_preserved":true,"review_unit_traces":[{"architect_evidence_refs":["ev-tree"],"architect_node_ref":"node-root","ce_review_unit_id":"node-root","identity_unchanged":true},{"architect_evidence_refs":["ev-tree"],"architect_node_ref":"node-wrapper","ce_review_unit_id":"node-wrapper","identity_unchanged":true}],"selected_candidate_id":"ARCH-FAM-C","selected_candidate_id_unchanged":true,"selected_candidate_locked":true},"review_unit_trace_coverage":{"missing_node_ids":[],"required_node_ids":["node-root","node-wrapper"],"traced_node_ids":["node-root","node-wrapper"],"traces":[{"architect_evidence_refs":["ev-tree"],"architect_node_ref":"node-root","ce_review_unit_id":"node-root","identity_unchanged":true},{"architect_evidence_refs":["ev-tree"],"architect_node_ref":"node-wrapper","ce_review_unit_id":"node-wrapper","identity_unchanged":true}]},"selected_candidate":{"expected":"ARCH-FAM-C","matches":true,"observed":"ARCH-FAM-C","trusted_source":"ARCH-FAM-C"}},"diagnostics":[],"owner_repository":"rezahh107/EV4-Constructability-Engineer-Repo","run_id":"ce-intermediate-fixture-001","schema_id":"ev4-ce-intermediate-validation-carrier@1.0.0","schema_version":"1.0.0","source_identities":[{"identity":"ev4-ce-architect-stage-intake@1.1.0","sha256":"f8cede7b74b6d14b33004c26ed4eae267c1167cdc490d2ec960ed5b3e15a994b","source_kind":"architect_intake"},{"identity":"synthetic-intermediate-bundle-001","sha256":"bc2d905b8072cd4c7fb0d18e88261546eed1c067f42552de87953fc58bbffb77","source_kind":"architect_source_bundle"},{"identity":"CRR-INTERMEDIATE-001","sha256":"4f2d7386830a1b7f16212780b632963d55efba5da4dd984a436dc1cda537c74d","source_kind":"constructability_review"}],"status":"complete"}
